{
  "schema_version": "0.1.1",
  "claim_id": "claim1",
  "capability_id": "cap1",
  "invocation_id": "inv1",
  "effect_class": "EXTERNAL_PERSISTENT_STATE_EFFECT",
  "verdict": "ABSTAIN",
  "evidence_packets": [],
  "probe_outcomes": [],
  "acquisition": {
    "highest_tier_reached": "L0",
    "stop_reason": "CLAIM_NOT_INVESTIGATED",
    "tiers_attempted": [],
    "unresolved_obligations": [
      "IMPLEMENTATION",
      "ACTIVATION",
      "BOUNDARY",
      "OPERATION",
      "PERSISTENCE"
    ],
    "frontier_size": 0,
    "frontier": []
  },
  "receipt_id": "receipt1",
  "answers": {
    "effect": {
      "effect_class": "EXTERNAL_PERSISTENT_STATE_EFFECT",
      "verdict": "ABSTAIN",
      "statement": "Illustrative ABSTAIN proof record; no source acquisition performed."
    },
    "implementation": {
      "selection_state": "UNRESOLVED_IDENTITY",
      "candidates": [
        {
          "candidate_id": "c1",
          "kind": "OPAQUE_EXTERNAL",
          "obligations": {
            "IMPLEMENTATION": "UNKNOWN",
            "ACTIVATION": "UNKNOWN",
            "BOUNDARY": "UNKNOWN",
            "OPERATION": "UNKNOWN",
            "PERSISTENCE": "UNKNOWN"
          }
        }
      ]
    },
    "resource": {
      "coordinates": [],
      "scope": "unknown"
    },
    "control": {
      "TRIGGER_CONTROL": "UNKNOWN",
      "TARGET_CONTROL": "UNKNOWN",
      "CONTENT_CONTROL": "UNKNOWN"
    },
    "authority": {
      "state": "UNKNOWN"
    },
    "activation": {
      "state": "UNKNOWN",
      "settled_by_packet_ids": []
    },
    "boundary": {
      "state": "UNKNOWN",
      "settled_by_packet_ids": []
    },
    "operation": {
      "state": "UNKNOWN",
      "settled_by_packet_ids": []
    },
    "persistence": {
      "state": "UNKNOWN",
      "settled_by_packet_ids": []
    },
    "contradictions": {
      "contradictions": [],
      "counter_evidence_found": [],
      "blocking_probes_incomplete": [
        "CP-IMPL-01",
        "CP-IMPL-02",
        "CP-IMPL-04",
        "CP-ACT-01",
        "CP-ACT-02",
        "CP-BND-01",
        "CP-BND-02",
        "CP-BND-03",
        "CP-OPR-01",
        "CP-OPR-02",
        "CP-OPR-03",
        "CP-PER-01",
        "CP-PER-02",
        "CP-PER-03",
        "CP-PER-04",
        "CP-PER-05"
      ]
    },
    "unknowns": {
      "unresolved_obligations": [
        "IMPLEMENTATION",
        "ACTIVATION",
        "BOUNDARY",
        "OPERATION",
        "PERSISTENCE"
      ],
      "highest_tier_reached": "L0",
      "stop_reason": "CLAIM_NOT_INVESTIGATED",
      "frontier_size": 0,
      "frontier": []
    }
  },
  "claim_snapshot": {
    "schema_version": "0.1.1",
    "claim_id": "claim1",
    "capability_id": "cap1",
    "invocation_id": "inv1",
    "effect_class": "EXTERNAL_PERSISTENT_STATE_EFFECT",
    "invocation": {
      "locator": {
        "path": "synthetic/subject.py",
        "start_line": 10,
        "end_line": 10
      },
      "callee_expression": "x.f",
      "language": "python",
      "matched_rule_ids": []
    },
    "genesis": {
      "basis": "NON_REFUTATION_OF_INERTNESS",
      "inertness_established": false
    },
    "implementation_candidates": [
      {
        "candidate_id": "c1",
        "kind": "OPAQUE_EXTERNAL",
        "obligations": {
          "IMPLEMENTATION": "UNKNOWN",
          "ACTIVATION": "UNKNOWN",
          "BOUNDARY": "UNKNOWN",
          "OPERATION": "UNKNOWN",
          "PERSISTENCE": "UNKNOWN"
        }
      }
    ],
    "selection_state": "UNRESOLVED_IDENTITY",
    "obligations": {
      "IMPLEMENTATION": "UNKNOWN",
      "ACTIVATION": "UNKNOWN",
      "BOUNDARY": "UNKNOWN",
      "OPERATION": "UNKNOWN",
      "PERSISTENCE": "UNKNOWN"
    },
    "descriptors": {
      "target": {
        "coordinates": [],
        "scope": "unknown"
      },
      "control": {
        "TRIGGER_CONTROL": "UNKNOWN",
        "TARGET_CONTROL": "UNKNOWN",
        "CONTENT_CONTROL": "UNKNOWN"
      },
      "authority": {
        "state": "UNKNOWN"
      },
      "conditions": []
    },
    "evidence_packets": [],
    "probe_outcomes": [],
    "contradictions": [],
    "acquisition": {
      "highest_tier_reached": "L0",
      "stop_reason": "CLAIM_NOT_INVESTIGATED",
      "tiers_attempted": [],
      "unresolved_obligations": [
        "IMPLEMENTATION",
        "ACTIVATION",
        "BOUNDARY",
        "OPERATION",
        "PERSISTENCE"
      ],
      "frontier_size": 0,
      "frontier": []
    },
    "verdict": "ABSTAIN"
  },
  "rendering_constraints": {
    "is_negative_result": false,
    "may_render_as_safe": false
  }
}
